{
  "nodeId": "node-post-deploy-notify",
  "iterationIndex": 0,
  "callIndex": 0,
  "recordedPromptDigest": {
    "algorithm": "SHA-256",
    "digestHex": "1a2b3c4d1a2b3c4d1a2b3c4d1a2b3c4d1a2b3c4d1a2b3c4d1a2b3c4d1a2b3c4d",
    "byteLength": 240
  },
  "recordedOutput": {
    "text": "Deploy notification sent.",
    "debugAuthHeaderUsed": "Bearer sk-ant-api03-REDACT-THIS-LOOKS-LIKE-A-REAL-KEY-abcd1234efgh5678"
  },
  "recordedDecision": null,
  "stale": false,
  "recordedAtUtc": "2026-07-20T12:00:00Z"
}
